Review Title,Reviewer Name,Reviewer Location,Review Time,Verified,Review,Aircraft Model,Type Of Traveller,Seat Type,Route,Date flown,Overall Rating,Seat rating,Cabin rating,Food rating,Inflight Entertainment rating,Ground rating,Value of money,Recommended
could have just let me move,T Reddy,India,2025-03-18,"Trip | Since 2023, I have consistently avoided flying Qatar Airways because of my sub-par experience in Economy Class. There are only 2 options to Maputo either Qatar Airways or Ethiopian and I decided to go with Qatar. Mumbai to Qatar leg is operated by Indigo which has no IFE and on a 3.5 hour flight, you get a sandwich and a small juice with some crackers and really uncomfortable seats (I admit that was my mistake since I did not check thoroughly).  Boarding for the flight to Maputo was chaos by a disorganised gate agent. After departure they served a sandwich, due to the tight connection time, I did not have any time to pick up snacks at the airport. I ended up seated next to a plus sized lady with a rather fussy infant, who had a middle seat. Later, I saw there were quite a few empty seats and they could have just let me move and allowed both of us a bit of comfort, but by the time the seat belt signs were off, others had already spread out and fallen asleep in those seats. The main meal was served 1.5 hours before arrival in Maputo and while the taste was good it was inadequate. My IFE stopped working 5 hours or so into the flight. ","Since 2023, I have consistently avoided flying Qatar Airways because of my sub-par experience in Economy Class. There are only 2 options to Maputo either Qatar Airways or Ethiopian and I decided to go with Qatar. Mumbai to Qatar leg is operated by Indigo which has no IFE and on a 3.5 hour flight, you get a sandwich and a small juice with some crackers and really uncomfortable seats (I admit that was my mistake since I did not check thoroughly).  Boarding for the flight to Maputo was chaos by a disorganised gate agent. After departure they served a sandwich, due to the tight connection time, I did not have any time to pick up snacks at the airport. I ended up seated next to a plus sized lady with a rather fussy infant, who had a middle seat. Later, I saw there were quite a few empty seats and they could have just let me move and allowed both of us a bit of comfort, but by the time the seat belt signs were off, others had already spread out and fallen asleep in those seats. The main meal was served 1.5 hours before arrival in Maputo and while the taste was good it was inadequate. My IFE stopped working 5 hours or so into the flight.",A350-900 / Boeing 737 Max8,Solo Leisure,Economy Class,Mumbai to Maputo via Doha,March 2025,2/10,2.0,2.0,2.0,,1.0,2,no
Indigo service not up to expectations,T Reddy,India,2025-03-18,Trip Verified,,A350-900 / Boeing 737 Max8,Solo Leisure,Economy Class,Maputo to Mumbai via Doha,March 2025,6/10,4.0,3.0,3.0,3.0,4.0,3,no
Very consistent service,Luis De Jesus,United States,2025-03-16,Trip Verified,"Another great flight. Very consistent service, consistent quality of food and comfortable aircraft. The service on the flight was just spot on. I would recommend them based on how consistent they are.",,Business,Business Class,Bangkok to Doha,February 2025,10/10,5.0,5.0,5.0,5.0,5.0,5,yes
service was spot on,Luis De Jesus,United Kingdom,2025-03-16,Trip Verified,"Amazing from beginning to end. Amazing service, food and cabin. The variety and the quality of the food is mind blowing. The service was spot on and attentive. The seat was comfortable and private.",,Business,Business Class,Doha to Phuket,February 2025,10/10,5.0,5.0,5.0,5.0,5.0,5,yes
top quality crew,Luis De Jesus,United States,2025-03-16,Trip Verified,"This flight was just the dream! 14hrs of first class service with top quality crew, amazing food, great Q Suite. The flight was so smooth, and pleasant, the hospitality was amazing.",,Business,Business Class,Doha to New York,February 2025,10/10,5.0,5.0,5.0,5.0,5.0,5,yes
ruined a checked roller bag,Mike Grandinetti,United States,2025-03-15,Trip Verified,"Dammam with a stop in Doha en route to Boston they ruined a checked roller bag of mine. 3 months later, I have yet to get any resolution. They have delayed repeatedly, sending me in an endless circle of unresponsive bureaucracy. I have lost respect for what was once my favorite airline.",,Business,First Class,Damman to Doha,December 2024,2/10,4.0,4.0,,,1.0,1,no
chaotic transfer at Hamad airport,Michael Schade,Thailand,2025-03-12,Trip Verified,"Checkin, security and immigration at DXB airport swift, lounge with good a la carte options and friendly service. Boarding well organized. Delayed by 45 minutes due to bad weather. Flight uneventful. Despite delayed arrival, remote stand with bus transfer. It took me 50 minutes from arrival at remote stand till arrival at the terminal.  My plan to have a nice breakfast at the lounge was shattered. I had just a 10 minutes at the Platinum/Gold lounge, but left because there was no seat available, no clean cup to make a coffee, and long toilet queues. My flight to Bangkok was a remote stand bus gate. Boarding was poorly organized, as Business class and status guests were asked to wait till Economy has done boarding; the gate agent changed his mind and let C Class and status guests on the bus after 2 bus loads of Y class passengers had gone. It was rather chaotic. The flight on a leased CX aircraft was on time and uneventful. The IFE screens in the bulkhead rows of my section were broken, but large IPads were offered as a replacement, which was great. My food was mediocre. The flights were ok, but the chaotic transfer at Hamad airport left a bitter aftertaste.",A350,Solo Leisure,Economy Class,Dubai to Doha,February 2025,4/10,4.0,4.0,3.0,4.0,1.0,2,no
pleasant and uneventful,Michael Schade,Thailand,2025-03-08,Trip Verified,"First leg was in Economy, 2nd in First. Check in at BKK airport fast and friendly. Contract lounge at the new Satellite terminal large, but limited western breakfast options. Boarding started 30 minutes late and another 15 minutes wait at the air bridge. Service was good with slightly improved F&B offerings. I was lucky to be on an aircraft with their upgraded WIFI services which worked real well. 3-4-3  configuration with rather hard seats. Transfer in Doha was good with a stay at the Al Safwa F lounge. Food was good. My final leg to Dubai was changed from a Qsuite to a 2-2-2 configuration. After many back and forth, they were willing to change to another Qsuite flight 30 minutes later. The flight was pleasant and uneventful.",B773/A350,Solo Leisure,Economy Class,Bangkok to Doha,March 2025,6/10,4.0,5.0,4.0,4.0,5.0,4,yes
Qatar Airways changed the aircraft,J Dayle,United States,2025-02-24,Trip Verified,Qatar Airways changed the aircraft and did not notify us. We entered the Boeing 777 cabin to find that we had Paid for a Mercedes and would be flying in a Mini-Cooper. I didn't know airplanes with this drastically old configuration were still even in service. TIt was a miserable experience and we are changing our refundable return tickets to another airline. I won't be spending any money on Qatar Airways in the future!,,Business,Business Class,Chicago to Doha,February 2025,1/10,1.0,5.0,2.0,1.0,1.0,1,no
attendants were very helpful,S Melkov,United Kingdom,2025-02-24,Trip Verified,"On my way to Doha, it was amazing, flight attendants were very helpful and attentive. Doha to Colombo was delayed and after take off asked for a drink which I was told would be served in about 10 minutes, it took more than an hour for cabin crew to star serving drinks and food. After the service they never came back to ask if anything else was needed.",A330,Solo Leisure,Economy Class,Gatwick to Colombo via Doha,February 2025,3/10,5.0,2.0,,,5.0,4,yes
Both flights were excellent,Walter Gujer,Thailand,2025-02-18,Trip Verified,"Both flights were excellent. Kind and professional staff on both flights, good food options (like that I can chose when to eat), comfortable flights. Due to distances at Doha airport, I appreciated that one of the small cart drivers offered his services to take me as close as possible to the train, connecting me to the center of the main terminal.",A350 / Boeing 777,Solo Leisure,Business Class,Zurich to Bangkok via Doha,February 2025,10/10,5.0,5.0,5.0,4.0,5.0,5,yes
discourtesy with the security staff,K Brawn,United Kingdom,2025-02-18,Trip Verified,"I have been a frequent traveller throughout my nearly 60 years as an air passenger. In all that time, I have never encountered such an unprecedented level of discourtesy as I did with the security staff at the Qatar Airways gate. at Doha. My husband and I had already smoothly passed through two transit security checks with Qatar Airways on our return journey from New Zealand. As we tried to board Business Class, I was surprised to be pulled over again for another bag check. The treatment I received was rude and demeaning. Everything in my rucksack was unpacked, which was then swabbed inside and out. I was manually body searched in front of everybody and my clothes, shoes and even hair was swabbed. This took place for a prolonged period of time in front of every other passenger that filed past - the flight had been called. When I subsequently touched one of the items in the second tray of my belongings (to open the zip to demonstrate there were only documents inside) the lady raised her voice, ordering me to stand back and not to handle any of my possessions. I tried to explain I was only trying to help but was met with more incivility. I would add that my husband, who was stood with me, had to witness this affront without any recourse to offer his assistance. When I was finally allowed to leave - the lady having found nothing of any suspicion - I felt utterly humiliated. This awful experience with Qatar Airways was only saved by the helpful and impeccable service of a wonderfully professional air steward on board called Eugenia - thank you kind lady. Her humanity and warmth restored my equilibrium. However the overall experience of our return journey was that, with the exception of Eugenia, the customer service is appalling. . I understand security is important but there was no need for my encounter to be as intimidating, embarrassing and uncivil as it was.",,Couple Leisure,Business Class,Melbourne to Gatwick via Doha,February 2025,1/10,5.0,2.0,2.0,2.0,1.0,3,no
Good but food needs improvement,Ishan Jani,United States,2025-02-13,Not Verified,"The food was really good, but the items listed on the menu, such as coconut cheesecake and stir-fried noodles, were unavailable. The seats were small but had amazing sleep amenities. The amenities kit was excellent. I requested an Asian vegetarian meal, which was very good, but it would have been better if there was naan or roti. The food quantity needs improvement. The legroom was good but could be better. This was my first time flying with Qatar Airways, and I would fly with them again.",A350-1000,Family Leisure,Economy Class,Miami to Doha,January 2025,6/10,3.0,5.0,5.0,5.0,5.0,3,yes
the flight was amazing,Ishan Jani,United Kingdom,2025-02-13,Not Verified,"So this was my first time on a 787-8. The seats are different on this plane compared to the Airbus A350. The 787-8 was really good, but I didn’t like the way the headrests were. The legroom was kinda tight with not much space, and I didn’t get a window seat—I got a middle row seat instead. But the flight was amazing. That mango juice is too good, omg! The food was great as well. There was palak paneer, but there was no paneer, only corn.",787-8,Family Leisure,Economy Class,Doha to Ahmedabad,January 2025,7/10,4.0,5.0,5.0,5.0,5.0,3,yes
epitome of comfort and privacy,Rajan Parrikar,Iceland,2025-02-10,Trip Verified,"Doha to Copenhagen in Business Class on an A350-900. This aircraft featured the renowned Qsuite configuration - an epitome of comfort and privacy. Qatar Airways’ onboard service was nothing short of world-class, delivering excellence at every touchpoint. Both the hard and soft product were executed to perfection, setting a standard that is unmatched in commercial aviation.",A350-900,Solo Leisure,Business Class,Doha to Copenhagen,February 2025,10/10,5.0,5.0,5.0,,5.0,5,yes
true premium service,Rajan Parrikar,Iceland,2025-02-10,Trip Verified,"Goa (GOX) to Doha in Business Class on a 787-8 The seating on this aircraft was of the older configuration, yet exceptionally comfortable. Service, as expected, was impeccable - flawless execution in line with Qatar Airways’ consistently high standards. Upon arrival in Doha, disembarkation was via stairs rather than an aerobridge. This is where Qatar Airways truly excels: the moment the first batch of Business Class passengers boarded the transfer bus, there was no unnecessary delay. Rather than waiting for it to fill up, the bus departed within minutes - a hallmark of true premium service.",Boeing 787-8,Solo Leisure,Business Class,Goa to Doha,February 2025,10/10,5.0,5.0,5.0,,5.0,5,yes
excited to fly again on an A380,Walter Gujer,Thailand,2025-02-08,Trip Verified,"Very excited to fly again on an A380, my favorite aircraft. Check-in was nice and friendly, loved the lounge and staff there too! While the male crew were nice and looked happy, the female staff were mostly sour. Did not appreciate when the crew put my meal on my tray while I was at the bar. When I returned, the food was stone cold. I discussed that with the excellent purser. After that, the staff were sickly sweet. I decided to spend most of the time at the bar. Shame, but the next flight on Qatar was again excellent.",A380,Solo Leisure,Business Class,Bangkok to Doha,February 2025,7/10,5.0,3.0,,,5.0,4,yes
customer services unhelpful,Tilly Hoskins,United Kingdom,2025-02-08,Trip Verified,"All that Glitters is not Gold On board their aircraft, Qatar Airways aim to present a spotless and glamorous experience. But sadly the mask is slipping badly. The 3-4-3 configuration on their 777 fleet has rightly been described as a crime against humanity. My real complaint with the company comes however behind the scenes. If you EVER have to deal with customer services they are obstructive and unhelpful. I paid over £1000 for an Economy Convenience multi-city ticket with some inbuilt ticket flexibility. I wanted, and indeed needed for medical reasons, a 2 hour stop in Doha. I have to administer medication which it is not possible to do on board. It could, indeed, endanger other pax to do it on the aircraft rather than in the airport. So I was pretty miffed when Qatar changed their schedules and cut my connection time down to 1h20 and then refused to listen to me about it. They COULD have agreed to put me on the flight taking off 5 minutes before my original booking to keep my 2 hour layover intact, which was the same price, but they have refused to do this. This isn’t the first time I have bumped up against their intransigence and arrogance and, to be frank, I don’t think I shall ever fly with Qatar again. I would strongly warn you to be very very careful about using them.",,Solo Leisure,Economy Class,London Heathrow to Hong Kong via Doha,February 2025,1/10,1.0,1.0,,,1.0,1,no
exceptional service and attention,Samantha Svhucroft,Australia,2025-02-07,Not Verified,"I recently had the opportunity to fly to Prague with Qatar Airways, and I would like to commend the exceptional service and attention I received throughout my journey. I would like to specifically acknowledge Uttam and Wan, who went above and beyond to assist me in retrieving my phone that had fallen between my seat after the flight had already landed. I had to wait for an engineer to come on board, but they were on the floor with various tools trying to reach my phone. I am extremely grateful for their efforts. This is a prime example of going the extra mile, and I hope they receive the recognition they deserve. Please continue to uphold your excellent service standards.",A380,Solo Leisure,First Class,Perth to Prague,December 2024,10/10,5.0,5.0,5.0,5.0,5.0,5,yes
cabin crew worked tirelessly,Tai Wei Wong,Malaysia,2025-02-04,Trip Verified,"Had a pleasant experience with Qatar Airways. The sector from KUL to DOH was not perfect. The plane used was old and with a 2-2-2 business class configuration. Less privacy and lack of storage space. The crew made up to the deficit. Lobster meal was very good. The next sector from DOH to IAH was perfect. Business class passengers were given much priority. The in-flight supervisor came to introduce herself to each and every business class passenger. The cabin crew worked tirelessly to serve every request. Wonderful. Qsuites business class is simply amazing. I managed to catch 8 hours of sleep all together. The quality of the food served was top-notched. I tried purchasing the WiFi service but not successful though. Overall, very good quality of production and service. Only grudge is probably the price. It was much higher than any other airlines.",A350-1000,Business,Business Class,Kuala Lumpur to Houston via Doha,February 2025,9/10,5.0,5.0,5.0,5.0,5.0,4,yes
crew were attentive and approachable,Azlan Hashim,Malaysia,2025-02-03,Not Verified,"Cabin crew were attentive and approachable. Very clean cabin and toilet. Modern in flight entertainment, easy to use and quick response. I was impressed when the Cabin Crew In Charge or Purser came and introduced himself. I enjoyed travelling with their widebody aircraft although on a flight which is less than 5 hours.",Boeing 777-300ER,Solo Leisure,Economy Class,Doha to Istanbul,October 2024,8/10,4.0,5.0,4.0,5.0,5.0,5,yes
outstanding experience,Dr. Akeil Al-Faraj,Canada,2025-01-28,Trip Verified,"I recently flew with Qatar Airways from Doha to Amman on QR404, dated January 26th, and I must say, it was an outstanding experience! The check-in process was seamless, and the staff were friendly and efficient. The aircraft was modern and clean, with comfortable seating and ample legroom. The inflight entertainment system was impressive, offering a vast selection of movies, TV shows, and music. The food was delicious, with a variety of options to suit different tastes. What truly impressed me, however, was the exceptional service provided by the cabin crew. They were attentive, courteous, and went above and beyond to ensure that all passengers had a comfortable and enjoyable flight. Overall, I would highly recommend Qatar Airways to anyone looking for a top-notch flying experience. Keep up the fantastic work!",,Family Leisure,Economy Class,Doha to Amman,January 2025,10/10,5.0,5.0,5.0,5.0,5.0,5,yes
the service is always so good,Claus Falsig,Denmark,2025-01-27,Trip Verified,"I fly often with Qatar. Over 10 times per year, and the service is always so good. Very nice staff both at ground and at Cabin. I usually fly Economy and rarely get upgraded or I more often use points to upgrade my self. But still on long flights from Europe to Asia over Doha on Economy is a great experience.",,Business,Business Class,Copenhagen to Beijing via Doha,January 2025,10/10,5.0,5.0,5.0,5.0,5.0,5,yes
check-in at Calicut was slow,Shayne Haridas,Saudi Arabia,2025-01-27,Trip Verified,"My recent flight from Calicut to Hamad Airport on January 25th, 2025, was generally uneventful, but had several areas where I believe Qatar Airways could improve the passenger experience. Firstly, the check-in process at Calicut Airport was extremely slow, despite having completed online check-in beforehand. The cabin temperature remained uncomfortably warm throughout most of the flight. The quality of the in-flight meals, while tasty, was somewhat diminished by smaller portions. My breakfast croissant was completely flattened. The seats felt less spacious and harder than I'm accustomed to. Finally, I was disappointed by the limited selection of movies available on Oryx One.",,Solo Leisure,Economy Class,Calicut to Dammam via Doha,January 2025,4/10,1.0,4.0,3.0,1.0,1.0,2,yes
consistently ranks at or near the top,Rajan Parrikar,Iceland,2025-01-14,Trip Verified,"Doha to Goa (Mopa Airport) in Business Class on Qatar Airways. This short flight, lasting just under three hours, featured Qatar Airways' non-Qsuite Business Class seats. Despite the absence of Qsuite, the experience was supremely comfortable, as is expected. The onboard service was warm and attentive, complemented by their signature on-demand meal offerings. The seamless blend of comfort, service, and sophistication once again highlights why Qatar Airways’ Business Class consistently ranks at or near the top.",Boeing 787-8,Solo Leisure,Business Class,Doha to Goa,January 2025,10/10,5.0,5.0,5.0,,5.0,4,yes
noticeable upgrade in meal quality,Rajan Parrikar,Iceland,2025-01-14,Trip Verified,"Copenhagen to Doha on Qatar Airways in Business Class in Dreamliner 787-9. This aircraft features Qatar Airways’ standard non-Qsuite Business Class seating configuration. Despite the absence of the Qsuite, the seats are exceptionally comfortable, ensuring a luxurious experience. The inflight service was flawless, showcasing their hallmark on-demand meal service. I was particularly impressed by the noticeable upgrade in meal quality. The vegetarian option was thoughtfully prepared, with a refreshing lightness compared to the heavier, oilier meals of previous years. Overall, this was an outstandingly comfortable flight that lives up to Qatar Airways’ reputation for delivering the finest Business Class experience in the skies.",Boeing 787-9,Solo Leisure,Business Class,Copenhagen to Doha,January 2025,10/10,5.0,5.0,5.0,,4.0,4,yes
Crew always ready to help,Willy Fischer ,France,2025-01-09,Trip Verified,"Qatar Airways, economy class, Doha to Paris CDG, B777, 09 September 2024. As always with Qatar Airways, crew are genuinely welcoming and helpful, both on the ground and onboard. I was able to access the Silver Lounge in Doha. Again, crew (mostly from Qatar / Middle East) very welcoming. Food and drinks (including wine) of good quality. Boarding swift. Crew always ready to help. Food, drinks, movies onboard all fine. Qatar Airways still has a miles-based Frequent flyer system (contrary to other airlines within One World Alliance that now have a money-based system) - and this is really appreciated. Last, but not least, i however prefer to fly Airbus (A330 A359 A380) rather than its competitor. Will choose Airbus aircraft within One World Alliance whenever possible, on any given route.",Boeing 777,Solo Leisure,Economy Class,Doha to Paris CDG,September 2024,10/10,5.0,5.0,5.0,5.0,5.0,4,yes
we were silver members,David Sims,Australia,2025-01-05,Trip Verified,"I have never felt the need to give Qatar a negative review before. I am a Silver member, and travel exclusively Qatar Airways, and have done for many years but I will start looking at alternatives. My complaints were purely to in respect to the food and the food service. On this occasion it was so bad on both legs of my flight it did really spoil the experience. The plane was lovely, entertainment options good and seating comfortable. I will start with the food service, as a silver member you get a hostess visiting you at the start of the flight and ask you what you would like to eat come meal service, then to be told when the service arrives that that choice has run out. I normally sit with my wife in the central section and I have never fully understood why the food service is not synchronised to start at exactly the same rows on both sides of the plane.  I was in seat D and my wife in seat E, the hostess served my meal and moved on. I asked politely if my wife could have her meal and was informed that he was not doing the E seats only the D seat and she would have to wait till the other server arrived, who was about 15 rows forward and nowhere near our seats. I explained that we like to enjoy our wine and meal together at the same time, and that we were silver members and that someone had already taken our orders. He said he was allocated only to the D seats and could not do anything about it. I had finished my meal and had my tray cleared away and was served coffee, my wife still had not recived her meal, or a drink. It was some 45 minutes after I finished my meal that my wife required her meal and this was very disappointing and could have been resolved with flexibility by the staff. Now for the food Choices that  consisted of rice with  beef, or a chicken sausage wth frittata, and the 3rd which was pasta with a sauce.",A350-900,Couple Leisure,Economy Class,Barcelona to Doha,January 2025,2/10,5.0,2.0,1.0,5.0,1.0,4,no
the flight with Qatar Airways was great,L Han,Germany,2025-01-05,Trip Verified,"Overall the flight with Qatar Airways itself was great, but the flight with one of its partner Malaysia Airlines to KUL is just terrible. For the Munich to Doha route, usually it is flown by the Boeing 787 or A350-900 which does not have QSuite, but on the day of my travel, we got the 777 with QSuite which was a huge upgrade from these types of planes that usually operate this route. Food was great, Staff was great, Entertainment was Good, WIFI is free for Privilege Club Member up to 1 hour. Arrived in Doha and we enjoy their Al Mourjan Business Lounge located at The Garden. Then we continue to Kuala Lumpur with Malaysia Airlines and the food was terrible, entertainment was very limited, WIFI was slow and staff was not so great. Qatar Airways needs to stop handing over their flights to their partners like MH and continue to operate their own daily flights instead.",Boeing 777-300ER,Family Leisure,Business Class,Munich to Doha,January 2025,6/10,5.0,5.0,5.0,5.0,5.0,1,yes
