Review Title,Reviewer Name,Reviewer Location,Review Time,Verified,Review,Aircraft Model,Type Of Traveller,Seat Type,Route,Date flown,Overall Rating,Seat rating,Cabin rating,Food rating,Inflight Entertainment rating,Ground rating,Value of money,Recommended
they declined a small goodwill gesture,Paul Nicoll,United Kingdom,2026-07-09,Trip Verified,"There were several issues, including the onboard service, condition of the lavatory, problems with the moving map and a disappointing breakfas. I contacted Customer Care, and while they responded promptly, I was disappointed that they declined even a small goodwill gesture.",,Solo Leisure,Business Class,Sydney to Doha,July 2026,5/10,5.0,3.0,3.0,3.0,5.0,3,no
showed incredible leadership,Maher AlShaaban,Qatar,2026-06-24,Trip Verified,"Two and a half hours before our flight to Indonesia, we arrived at check-in and an unexpected Advance Passenger Processing (APP) flag locked my visa. My wife and son were cleared to board, but I was blocked. The initial supervisor emailed immigration authorities, informing us that waiting was our only option. I pleaded with the shift supervisor. He calmly replied, ""Unfortunately, an email is the only way, but we will do everything we can to make sure you don't miss this flight."" He kept his word, monitoring communications while front desk assistant fired off multiple ""Urgent"" follow-up emails in under ten minutes, pushing for a rapid response. Staff showed incredible leadership. He took decisive action to manually navigate the sync delay, forcefully pushing our check-in through.  We had 25 minutes to clear immigration, pass security, and reach Gate 24C. We reached the gate at 6:40 PM, ten minutes past takeoff. The gate agent had held the flight.",,Family Leisure,Economy Class,Doha to Jakarta,June 2026,10/10,3.0,5.0,4.0,1.0,5.0,5,yes
just had to just sleep,Alwaleed Althani,Qatar,2026-06-06,Trip Verified,"Came in on a connecting flight on Cathay Pacific flight from Guangzhou going onto Doha. At 2 AM everything at the airport was closed except for the lounges. Onboard nice QSuites but I just had to just sleep, and had no food or used entertainment.",A350-1000,Couple Leisure,Business Class,Hong Kong to Doha,May 2026,9/10,4.0,4.0,,,3.0,4,yes
sandwich no choice,Alwaleed Althani,Qatar,2026-06-06,Trip Verified,"A330 comfortable but very much underwhelming. Paper bags with a sandwich no choice, but as the flight that lasts 45 minutes getting there was more important.",A330-200,Couple Leisure,Business Class,CAN to HKG,May 2026,6/10,3.0,3.0,1.0,1.0,3.0,3,yes
cabin crew was professional and friendly,L Casine,France,2026-05-29,Trip Verified,"I recently flew with Qatar Airways on a Boeing 777-300ER and my experience was mixed overall, so I would rate it 3 stars. The onboard entertainment system was excellent, with a great selection of movies and internet access throughout the flight. The meals and drinks were also very good, and the onboard service from the cabin crew was professional and friendly. However, my seats was quite small and narrow. One of the biggest disappointments was the cabin baggage allowance of only 7kg, andthe extra baggage charges were 276 Chinese RMB (40usd- 35euros) per additional kilogram. The ground staff experience in Guangzhou was very unpleasant and poorly handled",Boeing 777-300ER,Business,Economy Class,Guangzhou to Doha,May 2026,6/10,2.0,5.0,5.0,5.0,2.0,2,no
Outstanding experience,K Dhanoop,Qatar,2026-05-21,Trip Verified,"Outstanding experience with Qatar Airways My recent journey was particularly memorable, as it was my second experience flying business class and it exceeded expectations.  Priority check-in eliminated long queues, and lounge access provided a calm, comfortable environment to relax. Onboard, the seat was spacious and converted into a fully flat bed. The service was attentive without being intrusive, and the dining experience stood out as well, thoughtfully presented, with a variety of options. A special mention goes to the cabin crew whose service truly elevated the journey. Highly recommended.",,Solo Leisure,Business Class,Doha to Kochi,May 2026,10/10,5.0,5.0,5.0,5.0,5.0,5,yes
Very nice QSuites,Alwaleed Althani,Qatar,2026-05-19,Trip Verified,"Very nice QSuites, I had 5A which is back facing. Being tired I was not interested in having any food. The WIFI was great throughout the flight except over India. Cabin staff were nice not top notch Qatar Airways standard but still very good.",Boeing 777-300,Couple Leisure,Business Class,Doha to Guangzhou,May 2026,8/10,5.0,4.0,,4.0,5.0,4,yes
service was very good,Michael Schade,Thailand,2026-05-14,Trip Verified,"Frankfurt Airport check in was chaotic, it took me over an hour to check in. Flight to Doha was ok, with decent food and good service. Arrival transport in Doha was by remote stand and bus, despite a quiet airport. Al Safwa lounge good as always. Departure was by remote stand and bus and it wasn’t clear when BC was suppose to board as the special bus for BC wasn’t there. Going through this at 3 am contributes to the stress of travelling. Food was ok on the 2nd leg of the journey, service was very good",Boeing 789/ / 777-300,Solo Leisure,Business Class,Frankfurt to Bangkok via Doha,May 2026,5/10,4.0,5.0,4.0,3.0,1.0,3,yes
service was of excellent quality,Alwaleed Althani,Qatar,2026-05-11,Trip Verified,Evening departure from London and early morning arriving into Doha the timing didn’t give an opportunity fee to enjoy meals or entertainment but the service was of excellent quality. WIFI was excellent and the flight was short for the route the unfortunate issue of having remote parking in Doha can be a problem.,Boeing 777,Couple Leisure,Business Class,LHR to DOH,May 2026,9/10,5.0,5.0,,,5.0,4,yes
Boarding in Johannesburg was chaotic,Alwaleed Althani,Qatar,2026-04-09,Trip Verified,Boarding in Johannesburg was chaotic there should have been two airbridges but only one was utilized and this was on the ground staff in JNB. There was a menu but what was on the menu wasn’t what was catered and I ended up having to settle for a cheese platter of the lowest quality. I think Qatar Airways need to review their ground operations and catering in Johannesburg as I have done this route three times a couple of years ago and had a wonderful experience.,Boeing 787-9,Family Leisure,Business Class,Johannesburg to Doha,April 2026,6/10,3.0,3.0,1.0,4.0,1.0,4,yes
Very comfortable flight,Alwaleed Althani,Qatar,2026-04-06,Not Verified,My first experience on the Qatar Airways new Boeing 787-9 and they are equipped with a Qsuite while the 787-8 still has the old product. Wonderful IFE though it did not have Starlink WiFi just the old system. Very comfortable flight.,Boeing 787-9,Family Leisure,Business Class,Doha to Johannesburg,April 2026,10/10,5.0,5.0,4.0,5.0,5.0,4,yes
no realistic re-routing options,C Barlanek,Czech Republic,2026-03-15,Trip Verified,"My flight from Bangkok to Prague on 15 March was canceled due to the Middle East conflict 3 days before departure via email. No alternative was provided other than a flight a week later. ​Zero Communication: I sent 6 emails, tried the hotline repeatedly, used Live Chat, and reached out on X but absolute silence. No offer of accommodation, meals, no realistic re-routing options. I was forced to buy a new ticket with China Airlines at my own expense to get home",A380-800,Couple Leisure,Economy Class,Prague to Bangkok via Doha,February 2026,1/10,,,,,,2,no
a great lie-flat seat,Eelco van den Heuvel,Netherlands,2026-03-15,Trip Verified,"By far the cheapest option on short notice between Amsterdam and Bangkok. Paid little over 800 euros for a return. which was a very good price. Got the chance of an upgrade to business class however for a good price and decided to treat myself. From the moment you step on board you feel welcome. Adressed by your name and the stewardesses introduce themselves. Welcome drinks, dine on demand, great food, a great lie-flat seat and the cabin almost felt homely. Second leg equally good. I love the lounge in the A380. Relaxed boarding and out in no time.  Unfortunately my return flight was cancelled 4 times due to the conflict in the Middle East. I must say that I saw a lot of complaints about QR in which the airline was accused of not responding or not being reachable. My experience is different. I had to call them 4 times and I must I got through pretty quick. Yes, off course there is a waiting time in such an extreme situation. They easily booked me on a new flight every time it was cancelled. Since I could work from Thailand, I was not in a big hurry to get a flight home. After the last cancellation I requested to book me on another airline. Which was granted promptly.",A350/A380,Solo Leisure,Business Class,Amsterdam to Bangkok via Doha,February 2026,10/10,5.0,5.0,5.0,3.0,4.0,5,yes
Ticket was cheap,R Jones,United Kingdom,2026-02-18,Trip Verified,Check in chaos and bag drop took over one hour mostly due to extensive documentation checks by staff and oversized baggage. Boarding chaos and staff dealing with people in raised tone to control the volatile situation. Food main was tasty if the whole tray was rather small and main was cold (but tasty and edible). Cabin groomed to a high standard as were the staff.  I ordered a beer and it didn’t appear until a polite reminder 20 minutes later. Ticket was cheap so no real complaints. Would try again and hope for an improvement in check in and service levels.,Boeing 87,Business,Economy Class,Gatwick to Doha,February 2026,5/10,4.0,2.0,2.0,,1.0,5,yes
experience was not one of our best,Colin Kay,United Kingdom,2026-02-08,Trip Verified,"My wife and I have flown Qatar many times, but this experience was not one of our best. Hard product was good, although the 777 used on the DOH-MLE-DOH sector must be one of the oldest in their fleet and feels it. Soft product was not up to scratch on the LGW-DOH leg. This was a holiday flight and my wife and I like our wine. The brut champagne ran out before we were an hour into the flight, and the sauvignon blanc ran out before we were half way through the six hour flight.",,Couple Leisure,Business Class,London to Male via Doha,February 2026,5/10,5.0,5.0,1.0,,5.0,3,no
No compensation offered,R Morsch,Austria,2026-02-05,Trip Verified,"Bought a Business Class Lite ticket with no lounge access. First flight in QSuites was fine. In Doha our plane to Vie was 4 hours late due to operational reasons. No compensation offered, nothing. Flight itself was ok with a very mediocre lunch.",Boeing 777-300 / A350-900,Couple Leisure,Business Class,Doha to Vienna,February 2026,2/10,4.0,4.0,2.0,4.0,1.0,1,no
changed my pre arranged seat,Andrew Buckley,Ireland,2026-01-30,Trip Verified,"Parts of the seat in business class were broken and I wouldn't be able to use the arm rest. They changed my pre arranged seat to another, and when I asked why the ground staff said we can change your seat.",,Business,Business Class,Sydney to Doha,January 2026,2/10,,,,,4.0,2,no
predictably high-quality product,Rajan Parrikar,Iceland,2026-01-24,Trip Verified,"Goa (Mopa) to Doha in Business Class on a Boeing 787-8. The short three-hour flight departed on time. The cabin featured Qatar Airways’ older Business Class configuration rather than the Qsuite, but the seat remained very comfortable. On-board service was efficient and unobtrusive. Overall, a predictably high-quality product from this airline.",Boeing 787-8,Solo Leisure,Business Class,Goa to Doha,January 2026,9/10,5.0,3.0,,,5.0,4,yes
my seat was cramped,Rajan Parrikar,Iceland,2026-01-24,Trip Verified,"Doha to Copenhagen in Business Class on a Boeing 787-9. The aircraft, about 6 years old, carried Qatar Airways’ pre-Qsuite Business Class cabin. In theory, still a premium product, but my seat was cramped and uncomfortable. The stewardess was disengaged, showed no warmth, and operated on autopilot, as if merely ticking boxes rather than attending to passengers. This was an unusually poor Qatar Airways Business Class experience.",Boeing 787-9,Solo Leisure,Business Class,Doha to Copenhagen,January 2026,4/10,2.0,1.0,3.0,,5.0,4,yes
very impressed with the service,J Keshy,Ireland,2026-01-18,Trip Verified,"It was a fantastic experience from start to finish. The crew was professional, friendly, and helpful. I want to give a special mention to crew member named Denise whose service was outstanding. Additionally, the cabin manager was engaging and ensured everything ran smoothly. I am very impressed with the service and look forward to flying with Qatar Airways again.",,Solo Leisure,Economy Class,Dublin to Muscat via Doha,January 2026,10/10,4.0,5.0,5.0,4.0,5.0,5,yes
excellent service provided,Michael Schade,Germany,2026-01-14,Trip Verified,"Check in at Frankfurt Terminal 2 fast and friendly. Contract lounge average with poor F/B choices. Boarding not well organized despite having many gate agents on duty. I was asked to take a seat in the separate business class section of the waiting area. The section was already occupied by economy class pax since there was nobody to check the boarding passes at the entrance to the section. The flight itself was uneventful with decent food and drinks with excellent service provided by the chief purser of the flight being in charge of my side of the cabin. He worked tirelessly throughout the night and even explained the different wines; something which I never experienced after 100+ flights on Qatar. It’s unfortunate that I can’t recall his name, but I remember that he was from Malaysia. Arrival in Doha was unfortunately at another bus gate, despite having so many available contact gates. This cut my visit at the Al Safwa lounge short and there was just time to have a quick coffee. The flight to BKK on a full A380 was uneventful with again great service provided. Food on this flight was average. WiFi did not work throughout the flight",Boeing 787-8 / A380,Solo Leisure,Business Class,Frankfurt to Bangkok via Doha,December 2025,8/10,3.0,5.0,3.0,4.0,4.0,3,yes
food choices ran out,Jamie King,Portugal,2026-01-11,Trip Verified,"A complete lack of communication when trying to get in touch about baggage that was lost en route. The Chat on WhatsApp hasn't been answered in over 30 hours and the email I sent, not responded to so far. I called customer service who offered no help other than telling me to go to the website and couldn't offer any useful answer. On the flight the service was inconsistent. Twice, the food choices ran out offering only 2 meals on a duration of 17 hours. The in flight entertainment options were good but the seats were on the small side.",,Family Leisure,Economy Class,Auckland to Lisbon via Doha,January 2026,4/10,2.0,3.0,3.0,4.0,4.0,2,no
"elegance, comfort, and hospitality",Iman Yusuf,Austria,2026-01-11,Trip Verified,"From the moment I stepped aboard my Qatar Airways flight in Djibouti on January 8, 2026, until arrival Milan Malpensa the following day, I was enveloped in a world of elegance, comfort, and hospitality.  The cabin crew on both legs of my journey Djibouti to Doha, and Doha to Milan were nothing short of extraordinary. Their warmth, professionalism, and genuine attentiveness elevated every moment onboard.  Before I could even glance toward my empty glass, a smiling attendant was already offering a refill.  The cuisine was restaurant-quality and paired with premium beverages. Even the snacks between meals were memorable. And when I mentioned how much I enjoyed the chips, they brought me a second chips with a smile.  My stopover in Hamad Airport was magical and transformed my layover into a luxurious interlude. The seamless transit, spotless facilities, and intuitive design made navigating the airport effortless and even enjoyable.",A320 / A350-900,Family Leisure,Economy Class,Djibouti to Milan via Doha Hamad,January 2026,10/10,5.0,5.0,5.0,5.0,5.0,5,yes
Catering was average,Michael Schade,Thailand,2026-01-08,Trip Verified,"Check in, security check and immigration at BKK airport efficient and friendly. Contract lounge at the new Satellite Terminal average. There was an aircraft change from an ex CX aircraft with their premium economy seats, which I booked to an A380. Seat on the small economy section upstairs was quiet and reasonably comfortable. WiFi did not work. Catering was average with no butter, cheese or crackers. Main meal was ok. Service was fast and friendly. Boarding of the last sector at Doha airport was disorganized. After being toldat that the flight was not ready to board at boarding time and to take a seat, boarding started a minute later. Unfortunately, that was just half the case because the aircraft wasn’t ready and everyone had to wait on the airbridge for 20 minutes. The flight was uneventful with the same catering issues as the previous flight. WiFi was patchy, but worked at times. Flight arrived 20 min ahead of schedule. Service was somehow slow on this red eye flight.",A380/B788,Solo Leisure,Economy Class,Bangkok to Frankfurt via Doha,December 2025,5/10,4.0,4.0,2.0,4.0,3.0,2,yes
like a first class experience,J Calenski,United Kingdom,2026-01-06,Trip Verified,As a business class traveller the service with Qatar is excellent. The check in at Heathrow seamless and the lounge offers excellent range of food and drink along with flight announcements. I was fortunate to fly the Qsuite on both legs of the journey. It offers so much privacy and the in demand dining is a bonus. You are made to feel special and to be honest its more like a first class experience. I used Al Maha services to transit it was literally a 10 min transfer from the airbridge to the lounge and when it was time to board I was collected and fast tracked to board my second,Boeing 777,Solo Leisure,Business Class,Heathrow to Perth via Doha,December 2025,10/10,4.0,5.0,5.0,3.0,5.0,5,yes
deeply disappointing,Nenad Vukusic,Croatia,2026-01-01,Trip Verified,"Due to bad weather, the Abu Dhabi–Doha flight was delayed and then cancelled, causing a missed connection to Zagreb. Weather disruptions happen — that is not my complaint. The issue was the lack of assistance from Qatar Airways. There was no support, no hotel, no transport, no guidance. I was left to handle everything on my own for more than 24 hours at the airport. I am a Qatar Airways Gold member, and this experience was deeply disappointing.",,Solo Leisure,Economy Class,Abu Dhabi to Doha ,December 2025,1/10,1.0,,,,1.0,1,no
an incredible experience,Chantal van der Merwe,South Africa,2025-12-30,Not Verified,"This was an incredible experience. We always make use of Qatar airways but this time I decided to write a review! Very clean, neat, professional, friendly, humble. I had no problem or complaint. The absolute perfect ending to our European Holiday!",Boeing 787-9 / A350-1000,Couple Leisure,Business Class,Munich to Johannesburg via Doha,December 2025,10/10,4.0,5.0,5.0,5.0,5.0,5,yes
go-to airline for long travel,Mohamed Alkowari,Bahrain,2025-12-26,Trip Verified,Qatar Airways is currently my go-to airline for long travel and that’s for a good reason. The extra legroom seat was super comfortable and the food was very very delicious. The infotainment had an up to date library and the screens were huge. The complimentary Starlink Wifi was amazing and reliable.,,Solo Leisure,Economy Class,Tokyo Narita to Doha,December 2025,10/10,5.0,5.0,5.0,5.0,5.0,5,yes
ate and drank all that I wanted,Anders Pedersen,Rwanda,2025-12-26,Trip Verified,"Flew Qatar from Casablanca to Doha on Xmas eve 2025. This was the 2nd leg oof three flights across Africa with QR and partners. A350-900, on time. Was checked in earlier. Came directly from hotel to gate upon immigration and security. Boarding clear but tedious as flight was completely full. Onboard FAs were busy but managed well the full flight and did not run out of any foods or drinks despite the flight were for 7 hours I ate and drank all that I wanted. Even French sparkling wine was given ad libitum and people appeared to consume a lot on a Christmas eve. Felt in love with their fish dish, purely wild catch. Two other hot dishes were offered. IFE functioned fully; easy to navigate. In Doha I was given a 4-star hotel paid by carrier as next flight (with Rwandair) was 8 hours ahead. This, despite that I had lost my status in their frequent flyer program and was unrecognised. Luggage transfers went smooth. Miles given instantly.",A350-900,Solo Leisure,Economy Class,Casablanca to Doha,December 2025,8/10,3.0,3.0,4.0,4.0,4.0,4,yes
Crew was hard working,J Mursen,Germany,2025-12-24,Trip Verified,"Crew was hard working again on both legs. HAN - DOH: My snack, chicken sandwich or calzone was bad. My meal, fried rice with shrimp, was bad, almost no shrimp inside,only chopped pieces) DOH -DUS: We were bussed to the plane which took very long. Food was not as announced on the app but was good, butter and salt provided on inquiry.",Boeing 787,Couple Leisure,Economy Class,Hanoi to Dusseldorf via Doha,December 2025,7/10,2.0,5.0,3.0,3.0,3.0,4,yes
revelation on this flight was Starlink,Rajan Parrikar,Iceland,2025-12-22,Trip Verified,"Doha to Goa in Business Class on the 787-8. This aircraft carried Qatar Airways’ older pod-style Business Class seat. While not a Qsuite, it remains exceptionally comfortable. Onboard service, long a Qatar hallmark, was superb once again. Taken as a whole, this Business Class product sits at the pinnacle of commercial aviation, only a shade below the First Class offerings still found on select airlines. The revelation on this flight was Starlink. With fast, reliable Wi-Fi, the distinction between ground and inflight connectivity has all but vanished. A new era has begun.",Boeing 787-8,Solo Leisure,Business Class,Doha to Goa,December 2025,10/10,5.0,5.0,,,4.0,4,yes
at the top of the industry,Rajan Parrikar,Iceland,2025-12-22,Trip Verified,"Copenhagen to Doha in Business Class on the 787-8. Qatar Airways fielded the older pod-style Business Class seat on this aircraft - short of the Qsuite experience, but still exceptionally comfortable. Service was warm, attentive, and efficient throughout. At this point, Qatar’s Business Class feels like a mature, confidently delivered product, and it is easy to understand why the airline remains at the top of the industry. The sole disappointment was connectivity: this aircraft was not fitted with Starlink, and the paid Wi-Fi was mediocre. Where it matters, though - punctuality and comfort - Qatar continues to set the standard.",Boeing 787-8,Solo Leisure,Business Class,CPH to DOH,December 2025,10/10,5.0,5.0,5.0,,4.0,4,yes
remains my choice of airline,Mercy Alexander,United States,2025-12-17,Trip Verified,"I recently flew with Qatar Airways and had an excellent experience from start to finish. From check-in to arrival, everything felt well-organized and professional. Qatar remains my choice of airline for my home travels as due to convenience, less stops, better service and experience. I flew American from Dallas to Doha and had to pay for my second baggage even as an international passenger and will have to pay for return ticket too. I would request Qatar Airways to advocate for second baggage free when partnering customers who have to fly American and Qatar. That would be a great service to passengers. Boarding was smooth, and the flight itself was calm and well-managed. Small details — like frequent check-ins from the crew and overall comfort — really stood out and made the journey enjoyable. Everyone at Qatar was courteous. I love the airport assistance that is available throughout and would like to send kudos for managing it so efficiently. Overall, Qatar Airways delivered a high-quality travel experience, and I would confidently choose them again and recommend them to others.",,Solo Leisure,Economy Class,Philadelphia to Nagpur via Doha,December 2025,9/10,5.0,5.0,5.0,5.0,5.0,5,yes
quite underwhelming,T Lusillo,Australia,2025-12-17,Trip Verified,"My experience was quite underwhelming, the segments I took were delayed minimum 1 hour. Forget about oneworld alliance status to access priority boarding or any of the perks partner airlines traditionally give, with Qatar I needed to constantly ask them and they don’t seem to like reciprocating the entitlements. The plane from Melbourne to Doha had seen better days, the cabin was uncomfortable and tired, the toilets were filthy.",,Family Leisure,Economy Class,Doha to Paris ,November 2025,3/10,2.0,1.0,3.0,3.0,2.0,4,no
remains my airline of choice,Ahmed Almannaei,United Arab Emirates,2025-12-16,Trip Verified,"As a frequent traveler and a loyal Privilege Club member, I choose Qatar Airways for the exceptional level of service they provide. From the moment of check-in to arrival, the experience is seamless and well-organized. The cabin crew are highly professional, attentive, and focused on passenger comfort. The on-board product reflects premium quality, with excellent seating comfort, in-flight entertainment, and high standards of hospitality. Hamad International Airport continues to set a global benchmark for efficiency and passenger experience. Qatar Airways’ commitment to service excellence is evident in every journey. Qatar Airways remains my airline of choice, and I highly recommend them to anyone seeking reliability, comfort, and world-class service.",A320 / Boeing 787-8,Couple Leisure,Business Class,Sharjah to Phuket via Doha,December 2025,10/10,5.0,5.0,5.0,5.0,5.0,5,yes
