Review Title,Reviewer Name,Reviewer Location,Review Time,Verified,Review,Aircraft Model,Type Of Traveller,Seat Type,Route,Date flown,Overall Rating,Seat rating,Cabin rating,Food rating,Inflight Entertainment rating,Ground rating,Value of money,Recommended
no covered canopy on the stairs,P Craig,Australia,2024-01-25,Trip Verified,"When my flight with Qatar was delayed through no fault of Qatar, fog bound, in Georgia I experienced Qatar at its worst. Planes flew the next morning but we had a 26 hour delay. When they sent us to a very nice hotel they had only one hour person issuing vouchers and hotel arrangements for a plane load. They transferred us to the hotel and we returned to the airport and we sat and watched the following days scheduled flight, that we were meant to be on, leave with passengers and we had to sit and wait another 2 hours, which was consequently delayed another hour through unexplained circumstances which caused for an additional six hour layover in Doha. On checking in again I had a silver pass and there were three of us lined up for business class check in. My friend in economy was 30 deep and she got served before I did. We then had three gate changes without any announcements, we had to find the gates and on the boards there was no information as to what flight was leaving. They bussed us out to the plane on the tarmac in Georgian winter weather, there was no covered canopy on the stairs up to the plane as we stood in the rain waiting to board. I contacted Qatar help on the number given to me by Qatar and they said I have to email ""talk to us"" which only responded to half my email.  When I wrote a complaint I was addressed using a wrong name.  I wrote earlier in 2023 about a sublime flight, as they say from the sublime to the ridiculous.",,Solo Leisure,Economy Class,Tbilisi to Doha,December 2023,2/10,3.0,4.0,4.0,1.0,1.0,1,yes
cabin crews are friendly and professional,Karen Chan,Singapore,2024-01-22,Trip Verified,"First time travelling long distance by Qatar Airways. It was a 17hr flight. Cabin is well-maintained and clean, very spacious for 900/1000 series. The leg space was ample and seat space is great too. The cabin crews are friendly and professional but among them, there is 1 steward who went extra miles to make my journey extra special. He seems like the most junior one but he was very confident and helpful. As I was traveling with a broken foot, he assisted me with my hand carry bags till the point I left the cabin (taken over by ground staff). Every crew did their jobs but he made an extra effort to help a passenger. Thank You for his kindness.",A350-900/1000,Solo Leisure,Economy Class,Spain to Singapore via Doha,January 2024,8/10,5.0,5.0,4.0,5.0,5.0,4,yes
genuine warmth and hospitality,David Owen,Australia,2024-01-18,Trip Verified,"I have flown with Qatar in economy, business and in first class. I fly two or three times a year with them. I recently had the privilege of experiencing the epitome of airborne luxury aboard the world's best airline, and I must say that the exceptional service provided by the cabin crew left an indelible mark on my travel experience. From the moment I stepped on board until the final descent, every aspect of the journey was a testament to the dedication and professionalism of the airline's remarkable cabin crew. Beyond the technical aspects of the service, what truly set this airline's cabin crew apart was their genuine warmth and hospitality. It was evident that they enjoyed their work and took pride in creating a positive and enjoyable atmosphere for passengers. Whether it was a friendly conversation, a reassuring smile, or going the extra mile to accommodate special requests, the cabin crew consistently exceeded expectations. In conclusion, the world's best airline undoubtedly boasts the world's best cabin crew. Their commitment to excellence, attention to detail, and genuine hospitality set a standard that other airlines would do well to emulate. Traveling with this airline is not just a journey; it's an unforgettable experience that leaves passengers feeling pampered, valued, and eager to embark on their next adventure with the finest cabin crew in the skies.",A380,Solo Leisure,First Class,London to Perth via Doha,January 2024,10/10,5.0,5.0,5.0,5.0,5.0,4,yes
Four excellent flights,G Meares,Lebanon,2024-01-17,Trip Verified,"Four excellent flights, including two ultra-long haul flights from Doha-Auckland return, and all were excellent. Cabins were clean, comfortable and spacious. Meals were decent - maybe a bit on the small side, but good quality. IFE was also good, plenty of choices there. What really stood out though was the service - staff were almost consistently friendly, polite, attentive and caring. I had a couple of crew who really looked out for me, introducing themselves, offering regular drink top-ups (decent selection of wines were offered) and priority meal selection as a silver FF member. I find this impressive for a low silver status. Great flights!",A350-1000,Solo Leisure,Economy Class,Beirut to Auckland via Doha,January 2024,8/10,4.0,5.0,4.0,4.0,4.0,4,yes
lack of empathy,Aled Davies,United Kingdom,2024-01-15,Trip Verified,"Upon arriving in Doha, a 30-minute bus ride from the plane to the terminal and an interminable wait at security caused me to miss my connecting flight. What followed was a horrendous 18-hour layover during which I was denied accommodation and food assistance. The transfer desk's response? ""No hotels available for you."" I discovered available rooms at nearby hotels myself, costing me £300. This level of service is beyond comprehension, Qatar Airways left me out in the cold with expenses I should never have incurred. In my extensive travels, I have never encountered such incompetence and lack of empathy.",,Business,Economy Class,Gatwick to Erbil via Doha,January 2024,1/10,1.0,1.0,,,1.0,1,no
offered me a ridiculous compensation,A Qarani,United Kingdom,2024-01-14,Trip Verified,"Following a downgrade of my flight Bali to London from business to a seat first in Economy and then a seat without power or possibility to move it, Qatar Airways offered me a ridiculous compensation of 10k avios worth 100$. No alternative business flight was offered and the compensation is an insult given the price of the ticket.",,Business,Business Class,Bali to London via Doha,January 2024,1/10,1.0,3.0,2.0,1.0,1.0,1,no
Flawless onboard service,Rajan Parrikar,Iceland,2024-01-13,Trip Verified,Doha to Goa in Business Class on Boeing 787-8. This 3 hours flight was on time. Business Class seat configuration was the older product (no Qsuite) but very comfortable nevertheless. Flawless onboard service that we have come to expect from Qatar. Summary: it doesn't get better than Qatar Airways in Business Class.,Boeing 787-8,Couple Leisure,Business Class,Doha to Goa,January 2024,10/10,5.0,5.0,3.0,4.0,5.0,4,yes
lived up to its reputation,Rajan Parrikar,Iceland,2024-01-13,Trip Verified,"Copenhagen to Doha in Business Class on a Boeing 787-9. Qatar Airways lived up to its reputation as the finest Business Class product. On this 787-9, the seats were the older type (not the Qsuite) but very comfortable nevertheless. Onboard service was flawless. Qatar serves meals on demand in Business Class. If there is one point of criticism it is that the food served could do with more attention to both the quality and care in preparation. WiFi worked very well throughout the flight. All in all, a relaxing, comfortable flight.",Boeing 787-9 ,Couple Leisure,Business Class,Copenhagen to Doha ,January 2024,10/10,5.0,5.0,3.0,4.0,4.0,4,yes
received a below average,Nazir Ahmed,United Kingdom,2024-01-12,Trip Verified,"The in flight staff was not attentive at all. Requested mango juice as part of lunch, never arrived. The attendant never came to offer me snacks or drinks. Paid 1200£ for a economy ticket, but received a below average service from this staff. It's their responsibility to attend every customer during the flight, they failed badly with me.",,Solo Leisure,Economy Class,Doha to Brussels,January 2024,1/10,2.0,1.0,1.0,,3.0,1,no
Flight to Doha was good,F Carsen,United States,2024-01-12,Trip Verified,"Flight to Doha was good. Qatar ground crew sent a message to arrive at the airport 4 hours before departure because of possible delays due construction. We arrived at the airport as instructed but there were no one at the check in counters. The counters were opened 3 hours before departure as usual. When I asked the Qatar agent on why we had to arrive 4 hours before departure, she didn’t know why and she opened the counters 3 hours before departure as scheduled. We requested for a wheel chair for 1 passenger when we booked the tickets, but we had to go back to the agent to order a wheelchair. We waited at a designated spot but no one came. We went through security to the lounge where they promptly got us a wheelchair to get to the gate.",A350,Couple Leisure,Business Class,Dallas Ft Worth to Doha ,January 2024,8/10,5.0,3.0,5.0,5.0,2.0,4,yes
found the cabin crew very professional,Clive Sayers,Australia,2024-01-11,Trip Verified,"I found the cabin crew very professional, courteous, proactive, and without a doubt they clearly enjoyed their job. The meals served were most enjoyable and well presented. The flight of 7 and 13 hours soon passed without any problems, well worth it.",,Solo Leisure,Business Class,Manchester to Adelaide via Doha,January 2024,10/10,5.0,5.0,5.0,4.0,4.0,4,yes
extraordinary efficiency and professionality,Theo Anastasakis,Greece,2024-01-11,Trip Verified,"We booked and confirmed our tickets to India 9 months before the date of departure. (ATH-DOH, DOH-CCU). At some point and close to departure date, we received an email from Qatar informing us that our flights were cancelled, and we should either ask for refund or reschedule. Our already booked program and domestic flights did not allow us to cancel and rebook new flights. A very polite Qatar staff assisted us over the phone to reschedule by adding an extra flight and 6-7 hrs additional traveling time to our outgoing flights (ATH-SAW-DOH-CCU) Waiting time in Doha for our connection was 50 min on both legs outgoing and returning. On both trips upon arrival at DOH , there was a lengthy bus ride from the plane to the terminal of almost 15-20 min which was followed by a hurried security check and then a sprint to the gate to catch the next flight, which we boarded last, to realize that our initially booked and prepaid seats  were messed up. The issue was smoothly and quickly resolved by the very polite and mindful cabin manager on QR 203 on Dec 17th. In any case, our mixed feelings from our eventful Qatar booking experience, were all surpassed by the positive impression of the cabin crew's extraordinary efficiency and professionality. All Qatar accolades go to the hard working cabin crew. I also wish to highlight the better passenger experience that the A350 offers compared to the one on B787, which felt very cramped.",A350 / Boeing 787,Couple Leisure,Economy Class,Athens to Kolkata via Doha,December 2023,8/10,3.0,5.0,5.0,,3.0,4,yes
staff were absolutely wonderful,Line Maria Flege,Denmark,2024-01-09,Trip Verified,"I flew from Ho Chi Minh friday the 5th of January 2024. I had a panic attack due to a fit of claustrophobia. I have never tried it before. It was one of the worst things I have ever tried. The staff were absolutely wonderful. I do hope this message can reach the staff somehow. I really want to thank them. So hereby, thank you very much for your kindness and understanding!",,Couple Leisure,Economy Class,Ho Chi Minh to Doha,January 2024,10/10,4.0,5.0,5.0,5.0,5.0,5,yes
great catering and service,Michael Schade,Germany,2024-01-07,Trip Verified,"Check in at DUS airport well organized and efficient. DUS third party lounge was nothing to shout about. Departure delayed by about an hour due to late arrival of incoming aircraft, no prior information given, the first info was given 10 min after the proposed boarding time. SMS from Qatar was received while on the plane already. Boarding rather chaotic despite 8 gate agents. But part of the boarding issues could be contributed to the increasingly impatient crowd. Flight was good with great catering and service. The usual remote stand arrival in Doha with longish bus transfer. Service at lounge was good. Departure gate for the next flight very crowded and also chaotic and unorganized. The poor sole agent at the door had to endure a lot of shouting and pushing; the zone system simply does not work at Doha airport. Flight itself was full and unremarkable, with average catering and service. WiFi didn’t work again throughout the entire flight. Arrival at &BKK also at a remote stand and long bus transfer.",Boeing 789 / 773,Business,Business Class,Düsseldorf to Bangkok via Doha,December 2023,5/10,5.0,4.0,4.0,4.0,1.0,2,yes
attempts to obtain a partial refund were ignored,Francesco Leonardi,Switzerland,2024-01-05,Trip Verified,"I booked a round-trip flight from MXP to BKK via DOH that, on paper, should have been very comfortable: 1-2-1 configuration on the first leg and Qsuites on the second leg. The day before travelling I received the email from Qatar Airways, informing me of the change of aircraft. I understand that, in certain circumstances, airlines have to change aircrafts for operational reasons from time to time, but when this happens and ends up in a sort of downgrade, it becomes quite annoying. The DOH-BKK flight, originally equipped with Qsuites, was replaced by an old 777 with a 2-2-2 configuration. I had to sleep on a very uncomfortable angled bed. Qatar Airways, in the email sent to me the day before the departure, wanted to emphasize two things:  If I wanted to keep the Qsuites, I could change dates for free; I obviously contacted them immediately and they proposed an alternative to me, but they told me that I would have to pay another 2700 EUR. I don't quite understand the meaning of free in it. Alternatively, despite the lack of Qsuites, I could still take advantage of all the luxury and comfort of Qatar Airways. My attempts to obtain a partial refund, even in the form of Avios were completely ignored.",Boeing 777-300,Solo Leisure,Business Class,Doha to Bangkok,December 2023,1/10,1.0,3.0,3.0,1.0,3.0,1,no
crew was enthusiastic and helpful,Michael Schade,Germany,2023-12-20,Trip Verified,"Well coordinated airbridge (a rarity at Doha airport nowadays) boarding. Newish B789 with comfortable seats, large and responsive IFE screens and decent food. Cabin crew was enthusiastic and helpful. Flight arrived ahead of time.",Boeing 787-9,Solo Leisure,Economy Class,Doha to Frankfurt,December 2023,9/10,5.0,5.0,4.0,5.0,4.0,4,yes
seats narrow and uncomfortable,M Haeles,Belgium,2023-12-20,Trip Verified,"Flight on time, remote stand bus transfer in BKK, something I have not seen in BKK for many years for a full service carrier and in Doha. The B773 was rather old, cold draft from exit door, my touch screen not well responding, food ok, seats narrow and uncomfortable. This was a very average flight.",Boeing 773,Couple Leisure,Economy Class,Bangkok to Doha,December 2023,6/10,2.0,3.0,3.0,2.0,4.0,3,yes
Service was excellent,Lyn Smithies,Australia,2023-12-19,Not Verified,We had seats on top level of A380. Two seats only together. Service was excellent and food and beverages also good. All in all a good flight and would fly with Qatar again.,A380,Couple Leisure,Economy Class,Doha to Sydney,November 2023,9/10,5.0,5.0,4.0,5.0,4.0,5,yes
I would expect a part refund,M Miron,United Kingdom,2023-12-18,Trip Verified,"My in-flight entertainment system did not work at my seat for the 8h+ flight. I flagged this to the flight attendants which attempted to fix it to no avail, so I had no entertainment. I raised this with customer services upon my return home as in my opinion I did not receive the service I paid for, and I would expect a part refund however I was met with a half apology and fabrications. I was told that according to their reports I was offered an alternative seat which I refused.",,Solo Leisure,Economy Class,Ho Chi Minh City to Manchester via Doha,December 2023,1/10,1.0,1.0,1.0,1.0,1.0,1,no
Overall excellent experience,Beata Assaad,Kuwait,2023-12-17,Trip Verified,"Overall excellent experience, service, punctuality, onboarding experience. Excellent Variety of Food and beverages. Number one airline in all aspects.",Boeing 787,Solo Leisure,Economy Class,Kuwait to Warsaw via Doha,December 2023,10/10,4.0,5.0,5.0,5.0,5.0,5,yes
all time most pleasant flight,Mohamed Alkowari,Bahrain,2023-12-13,Trip Verified,This has literally been one of my all time most pleasant flights. The food was top notch even for economy and the portions were super delicious. We were served restaurant level Thai and Vietnamese curries for dinner and lunch respectively. The infotainment was very advanced and you can easily use your phone to control it. The Wifi was also fast and reliable. I am definitely choosing Qatar Airways as my go-to option for all my Japan flights.,,Solo Leisure,Economy Class,Dubai to Tokyo via Doha,November 2023,10/10,5.0,5.0,5.0,5.0,5.0,5,yes
a level of service second to none,Dev Raghav Handa,United Arab Emirates,2023-12-11,Not Verified,"Qatar Airways provides (and has been providing) a level of service second to none. Be it the aircraft, the airport, the cabin crew, the ground staff or anyone bump into, it’s a joy ride. Having flown to almost every country and tried over 150 airlines, it wasn’t difficult to rate Qatar. Now I’m flying back to Dubai and an almost 7 hour layover at Doha intl. seems less given the past wonderful experience. Keep it up Qatar!",A350,Business,Business Class,Dubai to Delhi via Doha,November 2023,10/10,3.0,5.0,4.0,4.0,5.0,5,yes
I will be using Qatar Airways in future,Craig Cutts,United Kingdom,2023-12-09,Trip Verified,"After some pretty poor experiences this year using my preferred airline Singapore Airlines, I decided to try Qatar again after 6 years. Check in at Heathrow T4 quick and polite as was the boarding process. On board I found the A380 upper deck very good for economy, service from the crew was very good as was the food. Transfer in Doha quick and easy boarding for KUL done well and again seating felt roomy and comfortable even with the 3-4-3 seating on the 777, arrived KL a little early good flights. Returning check in polite unfortunately KLIA is a dreadful airport, possibly the worst in Asia with poor and uninterested staff along with poor facilities. That apart despite a 2 hour delay the flight to Doha was again pretty good, quick transfer in Doha all fine and the final flight to London was very nice. Bags recovered quickly, I will be using Qatar Airways in future.",A380 / 777-300ER / A350,Couple Leisure,Economy Class,London to Kuala Lumpur via Doha,December 2023,9/10,4.0,5.0,5.0,5.0,5.0,4,yes
Very nice flights with Qatar Airways,Cesare Recalcati,Italy,2023-12-04,Trip Verified,"Very nice flights with Qatar Airways. Aircraft clean and well maintained, professional cabin crew, they never disappoint. The only thing to complain is that I passed through Hamad International several times and they never used fingers but only buses. This implies long wait and traffic jam due to the high number of buses. I imagine this is due to the strong increase of Qatar Airways destinations, but in any case it's a pity for such a beautiful airline! All in all, very good work Qatar.",A350 / Boeing 777,Couple Leisure,Economy Class,Milan to Salalah via Doha,December 2023,9/10,4.0,5.0,4.0,3.0,2.0,5,yes
seats were really uncomfortable,C Dawson,Australia,2023-11-29,Trip Verified,"Overall, it was okay. The food was pretty good, leg room was acceptable (wouldn't say the best though), customer service was good. The seats however, were really uncomfortable, they were very thin and had next to no padding which on a 14 hr flight, followed by a 7hr flight was brutal. We couldn't wait to get off. After this we flew, Cathay Pacific, ANA, and Jetstar, I've also flown Emirates, Air NZ, Qantas, LATAM, and Virgin, so I have a lot to compare it to. I'd only fly with them again if they were significantly cheaper then competitors.",Boeing 777-300ER,Couple Leisure,Economy Class,Brisbane to Amsterdam via Doha,October 2023,6/10,2.0,4.0,5.0,5.0,4.0,4,no
I should have checked my luggage,C Hallam,South Africa,2023-11-25,Trip Verified,"I cover my checked bag with a cloth envelope to prevent it from scuffing. This flight plan involved a local carrier from Durban to Joburg and then Qatar to Doha then Chongqing. On my return flight, the plane was delayed for over an hour, due to mechanical issues in Doha. Consequently, by the time I landed in Joburg OR Tambo airport, passed through passport control, and picked up my baggage, my connecting flight was boarding. As OR Tambo re-check baggage was no longer operational, I had to rush to departures to check in my bag. The time was so time that the airline employee had to check with her supervisor to see if it could be loaded. I rushed through domestic security and was among the last passengers to board. When I landed in Durban, I had a chance to check my luggage and noticed damage. I complained at Durban airport and to Qatar. Qatar kept repeating that when I was in OR Tambo, I should have checked my luggage and filed a written damage report, which would have caused me to miss my plane.",,Business,Economy Class,Doha to Johannesburg,November 2023,3/10,2.0,3.0,3.0,3.0,1.0,2,no
we had to repack twice,D Murlen,Switzerland,2023-11-24,Trip Verified,Mahe - Doha. Allows 23kg + 7kg hand luggage per person. We had 1x large suitcase weighing 27kg and we had to repack twice even though we were under the permitted weight of 46kg. The lady and supervisor at check-in say there is no other way.  Mahé - Doha. Erlaubt 23kg + 7kg Handgepäck pro Person. Wir hatten 1x grossen Koffer mit 27kg und wir mussten 2x umpacken obwohl wir insgesamt unter den erlaubten 46kg lagen. Dame und Supervisor am Check-in sagen es geht nicht anderst.,,Couple Leisure,Economy Class,Mahé to Doha,November 2023,6/10,3.0,4.0,4.0,4.0,1.0,3,no
Seats are too narrow,R Rutgers,Netherlands,2023-11-24,Trip Verified,"Seats are too narrow, no space for my legs. Transfer in Doha was complicated and unfriendly personnel. Boarding was chaotic. Will not fly Qatar Airways again.",,Family Leisure,Economy Class,Lusaka to Doha,November 2023,2/10,1.0,3.0,2.0,3.0,1.0,1,no
The food was sub par,James Goldie,United Arab Emirates,2023-11-19,Trip Verified,"From an epic experience to merely average. Have flown with QR many times long haul and Q suite is epic and unbeatable. However 4 recent trips to Istanbul in business class including the most recent reduce it to very average. The plane is a leased ex Cathay 777 still sporting the green flashes of Cathay, circa 11 years old and feels it. My major gripe is around service and food and beverage. On such a short circa 3.30 hour flight it was pedantic, why have stellar wine list if staff do not actively ask me if I want a refill let alone ask if I would like any at all. The food was sub par with a tough overcooked steak no coffee service no follow up no greeting and no goodbye.",Boeing 777-300 er,Solo Leisure,Business Class,Istanbul to Dubai via Doha,November 2023,3/10,2.0,1.0,1.0,1.0,3.0,4,no
Both flights were excellent,S Barker,United Kingdom,2023-11-18,Trip Verified,I was originally booked to fly on Cathay Pacific on 22 October however the flight Melbourne to Hong Kong was delayed by nine hours and I would not make the connection to Manchester. It took Cathay 6 hours to rebook me for the next available day of a direct flight HK to Manchester only for the same thing to happen again. On the second occasion I managed to get re-routed using Qatar Airways and this proved to be a welcome lucky break. Both flights were excellent with decent legroom and comfortable seats. Meals were better than expected and FA were both efficient and friendly. I managed to get some sleep on both flights. During the night FA made several runs through the cabin with drinks and snacks for those who were awake. The Doha to Manchester flight was full with only a few spare seats we left Doha late but that was not a airline problem but that of several large family groups of passengers who had not booked seats together but felt that numerous other passengers should be relocated to enable them to be accommodated in a seating arrangement they deemed acceptable. Flight attendants could have been more forceful in getting passengers into their allocated seats but it took a senior crew member to establish order so we could depart.,A350 / Boeing 787,Solo Leisure,Economy Class,Melbourne to Manchester via Doha,October 2023,8/10,4.0,5.0,4.0,4.0,5.0,5,yes
My grievances were ignored,Kiasha Pettigrew,United States,2023-11-16,Trip Verified,"They charge an extra 100+ dollars for ""extra legroom"" without disclosing the fact that this area is used for bassinets, has extremely hard to reach Electric ports, and no TV or entertainment system unlike the other seats. There is no benefit to sitting here and in fact, as a result of sitting here, I got no sleep as I was sitting next to a newborn baby during a 13 hour flight. When I request a refund for the first seat I upgraded I was denied because I'd already flown the flight and ""used the seat"". My grievances were ignored.",,Solo Leisure,Economy Class,New York to Tbilisi via Doha,October 2023,1/10,1.0,2.0,,,1.0,1,no
