Review Title,Reviewer Name,Reviewer Location,Review Time,Verified,Review,Aircraft Model,Type Of Traveller,Seat Type,Route,Date flown,Overall Rating,Seat rating,Cabin rating,Food rating,Inflight Entertainment rating,Ground rating,Value of money,Recommended
cabin staff were amazing,Andrew Morgan,United Kingdom,2024-08-20,Trip Verified,"First experience of Qatar Airways and was very impressed. The cabin staff were amazing. They were extremely friendly and attentive, and always available when needed. The service given was the best I have experienced of any of the major carriers. Will definitely fly with Qatar Airways again, and would recommend others to experience them.",,Business,Business Class,Kolkata to London via Doha,August 2024,10/10,5.0,5.0,5.0,5.0,5.0,5,yes
help us find our missing luggages,L Alami,United Arab Emirates,2024-08-19,Trip Verified,First time flying with this airline and they missed to load our 5 luggages. Now it went missing for 8 days now. We reported the problem from the time we arrived at Dubai airport and we were constantly following up the issue through call and email but no one cared to help us. It is really frustrating knowing that they are the worlds best airline. Hoping that somebody will step up and help us find our missing luggages.,,Family Leisure,Economy Class,Singapore to Dubai,August 2024,1/10,1.0,1.0,1.0,2.0,1.0,1,no
seats not together,M Marsaham,Qatar,2024-08-16,Trip Verified,"We had a family booking where we  with 3 children under 12 and all of us are allocated to seats not together; we arrived early to the airport and no one helped; we ended up sitting on 3 different rows. The head of cabin crew lied to me before take off and told me she has sorted this out, but that never happened and her response was robotic and she  asked me to write a complaint.",A350,Family Leisure,Economy Class,Rome to Doha,August 2024,2/10,2.0,1.0,2.0,2.0,2.0,1,no
waiting for a response to my complaint,P Darson,United Kingdom,2024-08-12,Trip Verified,"One of the people in the group is 6 feet 4 inches so I booked and paid for three front row seats on the Qatar Airways web site. The payment for just over £240 went through and was confirmed. When I checked in we had been moved to a normal economy seat. The check-in staff at Dubai (not Qatar Airways staff) tried to resolve it but couldn't. I was told to go to the transfer desk at Doha where they would have an answer. The staff there could not care less. The answer was 'there is a family sat there so there is nothing we can do'. Then seemed surprised that I wanted a refund and handed me a card at me with some email addresses on it. We boarded and the seats we should have had were occupied by three other people. No babies, no baby bassinets or any other reason we were moved out of them. The tall person in the group had to sit with one leg in the aisle and one under the middle seat. It was uncomfortable. The seat pitch on the 787 was tight and of course the person in front reclined as soon as the aircraft left the ground. My food was rubbish. I did get a refund but 2 weeks later I am still waiting for a response to my complaint. I am unsure how Qatar presents itself as a 5 star airline.",Boeing 787,Family Leisure,Economy Class,Dubai to Manchester via Doha,July 2024,1/10,1.0,2.0,1.0,1.0,1.0,1,no
inconsistency in service quality,E Barsem,United Kingdom,2024-08-12,Trip Verified,"I recently traveled with Qatar Airways from Manchester to Dubai, with a layover in Doha, and unfortunately, the experience was far from the high standards I expected from a reputed 5-star airline. Check-In issues began at Manchester Airport, where the self-service check-in machines were difficult to use, and the staff provided little assistance. The process was unnecessarily stressful and time-consuming, contrary to the promise of digital technology streamlining the experience. Additionally, the staff at the baggage drop-off point were abrupt, warning us about excess baggage fees despite our luggage being well within the limit. This initial interaction was disappointing. Boarding the flight was another frustrating experience. The Qatar Airways representative insisted that each family member, including my autistic children, hold their own boarding passes and passports. This requirement seemed unnecessary and delayed our boarding process. A more considerate approach would have been appreciated, especially given the circumstances. The in-flight experience from Manchester to Doha was underwhelming, particularly the food quality. While the service at Dubai Airport was commendable, it was not provided by Qatar Airways staff. In contrast, the staff at Doha were abrupt, asking for passports in a manner that even my son found rude. This inconsistency in service quality is not what one would expect from a top-tier airline. Overall, my experience with Qatar Airways did not live up to the hype. The service was inconsistent, and the quality of food and customer interaction left much to be desired. Having flown with budget airlines that provided better service, I find it hard to justify the premium associated with Qatar Airways. It seems that the reputation of being the ""best airline in the world"" might be more about marketing than service delivery.",,Family Leisure,Economy Class,Dubai to Manchester via Doha,August 2024,3/10,1.0,1.0,1.0,4.0,2.0,1,no
you will be disappointed,Robert Anuro,United States,2024-08-08,Trip Verified,"A storm in Washington DC Dulles International Airport on 3rd August 2024 caused a major delay of our flight QR 708 to Doha for over four hours. The explanation did not come quickly until the passenger started complaining. The aircraft finally arrived but the conditions in the plane weren't appealing. One of the restrooms in the rear right did not have running water for washing the hands, although the flush toilet had water. Meals were being served without even sanitizers to Economy class passengers, notwithstanding the dirt some people had acquired from the toilets. The worst part begins when I miss my flight connection from Doha to Nairobi. I was shuffled from one desk to another and finally landed in Transfer desk A where after queuing for one and a half hours was issued with an Ethiopian Airline ticket to Addis Ababa and a Kenya Airways ticket from Addis-Ababa to Nairobi. I had a meeting in Nairobi which had started on 5th August and I was getting late. On arrival in Nairobi, my 2 suitcases were missing and I reported to KQ and was issued with a reference number NBO/KQ69813. As I write this review on 8th August, no information has reached me on the whereabouts of the suitcases. As the primary Airline I booked, I hold Qatar Airways responsible for the careless mishandling of my luggage as well as the inconvenience and costs of buying new clothes and other items that I need as the long wait continues. It makes me have a very low opinion of the Airline. The was just too much disorganization. You trust Qatar Airways at your own risk, wait, you will be disappointed. It can be disorganized worse than any struggling airline, it is hyped and overrated unnecessarily.",B777,Solo Leisure,Economy Class,Washington to Nairobi via Doha,August 2024,2/10,1.0,2.0,2.0,2.0,1.0,1,no
far from satisfactory,Alessandro Di Meo,Australia,2024-08-06,Trip Verified,"I recently travelled with Qatar and had a very disappointing experience. Customer service over the phone and via email, was terrible and unprofessional charged me more than what I supposed to pay for a ticket by not mentioning a credit card fee charged only if you book over the phone, unfortunately the the fee was not shown until the payment was made. The lounge provided at Adelaide was extremely low cost. It felt cheap and did not meet the standards one would expect from a business lounge of a premium airline. Additionally, my food on board was a letdown. It was served cold which is unacceptable. Therefore my experience with Qatar Airways was far from satisfactory.",,Solo Leisure,Business Class,Adelaide to Barcelona via Doha,June 2024,2/10,5.0,4.0,1.0,3.0,1.0,1,no
Customer service at Doha was very poor,Astrid Toegimin,Netherlands,2024-08-05,Not Verified,"Our flight was 5 hours delayed, so we missed our connecting flight. Only option offered was flight next day from Doha! No possibility to use business class or a partner, unless you pay. Customer service at Doha was very poor, hardly no staff to help the customers. At economy class one staff member, at business class next desk 3 staff but no customers. First transfer desk wasn't open, at the second we were told to back to the first one. One desk for about 100 plus people. As Doha is Qatar Airways home you woud expect it to be more fluent.",Boeing 777,Family Leisure,Economy Class,Jakarta to Amsterdam via Doha,August 2024,4/10,3.0,4.0,4.0,3.0,1.0,2,no
had an aircraft change,Russell Teasdale,United Kingdom,2024-08-04,Not Verified,"It was my first time flying Qatar, we arranged our itinerary around flying in Q Suites on a 4 leg journey. We were excited by the prospect of flying in ""the world's best business class"", as we are often disappointed when we fly business with other airlines. It started badly when we arrived at the lounge and were refused entry, we were told that the tickets were a promo fare with no lounge access. I argued that we were BA silver member so were entitled to access anyway. We were told that if we were flying in economy we could access the lounge but as we are in a business class promo fare we could not. The first leg was a Q Suite, it's decent but was on par with other products we had flown. The second leg was a planned non Q Suite configuration. I was shocked at the quality of the product, it was like business class a la 1990. The person sat next to me was as close as an economy seat, the bed was really uncomfortable. There was no leisure suit. I would say this was the worst long haul business class I ever flew. 2 days before the return journey, we received an email telling us that the first leg of the journey from Nairobi to Doha had an aircraft change and was the old product again. I really didn't want to fly in that plane so I called Qatar. The call to their call centre was virtually inaudible, lots of background noise, the operatives accent was so strong I could hardly understand them.  We managed to change the flight which involved an eight hour stopover in Doha. In addition I had to pay $300 to change our domestic flights to accommodate this. So we now had both legs is a Q suite, or so I thought. The day after going through all this drama we received another email telling us that the second leg of our journey (the 8 hour leg) had changed aircraft to the old configuration. I kept checking their website right up to the flight and they were still selling this flight (QR149) as a Q Suite product 48 hours after they had changed the aircraft to a non Q Suite plane.",Boeing 777,Family Leisure,Business Class,Nairobi to Madrid via Doha,August 2024,3/10,1.0,4.0,3.0,1.0,3.0,1,no
delayed for 8 hours,Jay Shah,India,2024-08-01,Trip Verified,My flight was delayed for 8 hours from San Francisco and my connecting flight was already left for Ahmedabad so I had to stay in Doha for 16 hours for my next flight to Ahmedabad. It was very irritating.,,Couple Leisure,Economy Class,San Francisco to Ahmedabad via Doha,August 2024,4/10,3.0,3.0,3.0,1.0,2.0,2,no
Really poor experience,C Marwan,United Arab Emirates,2024-07-30,Trip Verified,Really poor experience. After a missed connection I was offered an overnight hotel stay . I really didn’t want this so asked to stay overnight in the airport and go on an earlier flight. By 2:30am my only solution was to accept the hotel which was a 30 min bus ride from the airport. I travelled on a very shoddy mini bus with 10 men (I was the only female) at 2:30am to a very old and run down hotel. Checking in took another 30 mins where I refused to sign a document accepting I felt safe in the hotel. I was left with no other option . When I raised a complaint with Qatar once I finally got home they do not care. Not worth it especially if it’s a tight connection in Doha. Customer service on the ground had an attitude and we’re not listening to my concerns.,,Solo Leisure,Economy Class,Dublin to Dubai via Doha,July 2024,3/10,3.0,1.0,,,1.0,2,no
Service was great,Carolina Barrenechea,South Africa,2024-07-26,Not Verified,"We flew from Madrid to Doha. Overnight flight. It was perfect. Aircraft was comfortable. Staff were very friendly. Service was great. We had a layover of 4 hours in Doha approx. At 9 am we were ready to board but we were booted out of the plane and asked us to go to customer service. No explanation given. There was a long queue at customer service and it was chaos. It took us over an hour to get in front of the line and see an agent. No one explained why we were there, they just told us that we were going to be in the next plane at 02:20 am next day. They paid for our hotel and gave us meal vouchers and transport to and from the airport. We were also compensated in cash afterwards (once we submitted our claim). My only complaint is the lack of information given to the passengers. No one explains anything. They just tell you what to do and where to go. It was a very stressful situation because of the lack of info. If someone would had explained what was going on and WHY, we could had understood the process and our situation better and felt less stress. Travelling is sometimes stressful and there’s no need to add extra stress to it. Other than that, I think Qatar was great. They just need to stop overselling their flights to avoid these type of situations that are stressful for their passengers.",,Couple Leisure,Economy Class,Madrid to Johannesburg via Doha,July 2024,7/10,4.0,5.0,5.0,,5.0,5,yes
exceeded the weight,Enrique Puente,Spain,2024-07-22,Trip Verified,"In the future we will try to avoid this airline due to its policy regarding the weight of cabin luggage. They weighed our cabin luggage and added it to the weight of the carry-on bag; since it exceeded the weight, they forced us to check in the cabin luggage. The man who helped us was inflexible and despite the tremendous disruption that losing our luggage would cause us on a 45-day trip to Africa, there was nothing we could do. This is the first time this has happened to us in the last 10 years on an airline; airlines have not weighed cabin luggage for years. Not being able to carry luggage in the cabin due to a maximum weight of 7-8 kilos is a serious problem. It was impossible for me to check in online in advance, as the App and the website did not work.  En un futuro, lamentablemente, intentaremos evitar esta aerolínea por su política relativa al peso del equipaje de cabina. Nos pesaron el equipaje de cabina y lo sumaron al peso del bolso de mano, como superaba el peso nos obligaron a facturar el equipaje de cabina. El hombre que nos atendió fue inflexible y a pesar del tremendo trastorno que nos supondría la pérdida del equipaje en un viaje a África de 45 días, no hubo nada que hacer. Está es la primera vez que nos pasa en los últimos 10 años en una aerolínea, hace años que las aerolíneas no pesan el equipaje de cabina. No poder llevar equipaje en cabina por un tema de peso máximo de 7-8 kilos es un problema grave, pues todas las maletas de cabina, aunque se lleven poco enseres, siempre superan esta norma. Por otra parte, fue imposible realizar el checkin online con la debida antelación, pues tanto la App como la web no funcionaban correctamente. -",,Couple Leisure,Economy Class,Madrid to Doha,July 2024,3/10,3.0,3.0,3.0,3.0,2.0,3,no
give you whatever seats they want,Andrew Lehotzky,United States,2024-07-20,Trip Verified,"My wife and I purchased seats months in advance of our flights from Raleigh to Kilimanjaro and back. On the day of the flight we were told the seats didn't exist, and given other seats is basically the worst spots on the plane. Then when filing a complaint for a refund they deny it saying they can't refund because they gave us seat with ""similar characteristics"" as what we bought and the policy excludes refunds for that. We purchased seats together in the window aisle and were given seats in the middle aisle on every flight (3 out of 4) and one of which were not even together. I would not call this ""similar characteristics"" by any stretch of the imagination. This is a vague term they use to allow them to pre sell seats that don't exist, give you whatever seats they want, then claim you are not entitled to a refund due to similar characteristics.  I have had similar situations but always been refunded promptly with any other airline.",,Couple Leisure,Economy Class,Kilimanjaro to London via Doha,June 2024,1/10,1.0,1.0,1.0,1.0,1.0,1,no
Terrific business class seating,Billy D Baker,United States,2024-07-18,Trip Verified,"Excellent service from the ground staff to flight attendants. Very professional, caring in-flight service. Terrific business class seating and wonderful food.",,Solo Leisure,Business Class,Bangkok to Doha,July 2024,10/10,5.0,5.0,5.0,5.0,5.0,5,yes
did a wonderful job,Billy Baker,United Kingdom,2024-07-18,Trip Verified,"Perfect flight with very attentive ground and in-flight staff. The aircraft was clean, the food and in-flight entertainment was terrific. The professional flight attendants did a wonderful job ensuring everything was perfect.",Boeing 787,Solo Leisure,Business Class,Frankfurt to Doha,July 2024,10/10,5.0,5.0,5.0,5.0,5.0,5,yes
I can't even say how grateful I am,Armine Hovsepyan,Armenia,2024-07-18,Trip Verified,"I never write reviews, but this time I must do it. I want to thank Qatar Airways, the whole crew. You are the best. I was flying from Beijing to Doha, then from Doha to Yerevan. During my 1st flight, I got horrible pain, because of my kidney stone. I don't know how could I deal with it without the crew. I know it might be just part of their job, but the way they treated me, the support I got from them, meant a lot to me. I can't even say how grateful I am. Thank you again and again. Qatar airways is the best for a reason. From now on I know which airline I'm gonna use without a doubt and gonna recommend everyone.",Boeing 777-300ER,Solo Leisure,Economy Class,Beijing to Yerevan via Doha,July 2024,10/10,5.0,5.0,5.0,5.0,5.0,5,yes
Service was expectedly world class,Rajan Parrikar,Iceland,2024-07-13,Trip Verified,"Doha (DOH) to Goa (GOX) in Business Class on 787-8. It was a short flight of just over 3 hours. Seating was Qatar's traditional Business Class (not Qsuite), very comfortable. Service onboard was expectedly world class. There is a reason Qatar is currently the world's best airline. If there is a criticism to be made it was that the WiFi on this flight was extremely slow and spotty.",Boeing 787-8,Couple Leisure,Business Class,Doha to Goa,July 2024,10/10,5.0,5.0,3.0,,5.0,4,yes
a high level of comfort,Rajan Parrikar,Iceland,2024-07-13,Trip Verified,"Copenhagen (CPH) to Doha (DOH) in Business Class on 787-9. The Business Class seating on this aircraft was not the Qsuite configuration. But Qatar's traditional B-Class seats are nothing to complain about. They provide a high level of comfort. Service on board was exceptional, true to Qatar's recognized standards. If there is one area where Qatar falls short it is in the food department. The Indian vegetarian preparation was oily and prepared without attention to detail.",Boeing 787-9,Couple Leisure,Business Class,Copenhagen to Doha,July 2024,10/10,5.0,5.0,3.0,,5.0,4,yes
overall it was a good flight,Emilio Chrisostomou,Australia,2024-07-13,Not Verified,"The check in process was smooth and simple, they had self check in too which I liked, within 45 minutes I was sitting at the gate waiting to board my 10.45pm flight to Doha. When I arrived on the aircraft I was very kindly greeted by the cabin crew, it was lovely and bright when I got into the aircraft. When I arrived at my seat there was a pillow, blanket, headphones, and amenity kit waiting for me, they also had an adjustable head rest and reading light. Very good variety of entertainment on there and I was very impressed with how attentive the touchscreen was. About 1 hour after take-off they served the meal, it was very good food, then for about 7 hours they let you rest and then another meal - for me it was dinner and breakfast given the time of the flight. Qatar Airways food is not too bad at all! It was a smooth take-off and landing, overall it was a good flight, better than I expected and can't wait to fly home from holiday with Qatar Airways.",A380,Family Leisure,Economy Class,Perth to Paris via Doha,June 2024,10/10,3.0,5.0,4.0,5.0,4.0,5,yes
worst possible check in Singapore,Ranjan Ramchandani,Singapore,2024-07-11,Not Verified,"The worst possible check in Singapore. We were a family of three flying to Washington DC on 28th May in business class. The check in staff was uninterested, unhelpful almost to the point of being rude. She was taking almost 10 mins per passenger at check in. Onboard service was fantastic and second to none; the true Qatar service I had seen on a previous flight I had taken, but after this incident at Singapore airport, I would never fly Qatar Airways out of Singapore. It’s too stressful.",,Family Leisure,Business Class,Singapore to Washington via Doha,May 2024,5/10,3.0,5.0,4.0,3.0,1.0,3,no
no snack before landing,M Haider,Netherlands,2024-07-11,Trip Verified,The journey started from a bus gate to a remote stand via a packed bus. The Boeing 787 was old and needs a new interior in Economy class. My seat was hard with little leg room. The food was not good and no snack before landing; The stewardess was friendly but very slow. I was disappointed.,Boeing 787,Couple Leisure,Economy Class,Doha to Bangkok,June 2024,2/10,1.0,3.0,1.0,4.0,3.0,1,no
extremely helpful,V Vatsalya,United States,2024-07-11,Trip Verified,Ms Santra was extremely helpful in resolving the change in flight and timing. She worked on phone to work with me on a short notice and offered me the flights that were originally anticipated.,,Business,Economy Class,Boston to Delhi via Doha,July 2024,10/10,,,,,,5,yes
deeply disappointing experience,R Halsawan,United States,2024-07-10,Trip Verified,"I had a deeply disappointing experience with Qatar Airways. My return flight to Houston was canceled without any prior notification or apology from Qatar Airways. I discovered this only when I arrived at the airport, expecting to board my scheduled flight. The complete absence of communication was unacceptable and added unnecessary stress. When I called to check on alternative arrangements, I was informed that the next available flight was four days away due to all flights being fully booked. Qatar Airways made no effort to prioritize passengers whose flights had been canceled, nor could they provide me with the same seat I had initially booked. This lack of consideration and poor management of flight schedules was extremely frustrating and unprofessional. As a result, I am stuck in Doha for three additional nights, incurring expenses well beyond my budget. Despite explaining my situation repeatedly to the office manager, she offered no apology or compensation. There was no reimbursement for my troubles or the extra costs I incurred, and no one took accountability for this total fiasco. This experience has made it clear to me that Qatar Airways has no respect for their customers. The lack of communication, inadequate support, and unprofessional behavior of their staff were inexcusable. My flight is now scheduled for tomorrow morning and they made sure that I realise it’s not even guaranteed.",,Couple Leisure,Economy Class,Doha to Houston,July 2024,1/10,1.0,,,,1.0,1,no
kept my business class upgrade,E Beale,Australia,2024-07-08,Trip Verified,"At the time of my last booking I had a Gold Privilege membership and I did the booking for my travels later this year. I selected my economy seats. Qatar Airways upgraded a part of my travel to business class. Recently, they changed my membership to Silver and they kept my business class upgrade, however, cancelled other seat selections. There was no email, no phone call - I found out about the cancellation by chance. When I contacted Qatar airways, they told me to choose my seats again and pay for my seat selection.",,Couple Leisure,Economy Class,Adelaide to Milan via Doha,August 2024,2/10,,,,,,2,no
their exceptional service,Uzma Rana,United Kingdom,2024-07-07,Trip Verified,"I travelled from Islamabad to Newcastle (UK) on 1st July. My flight from Doha to Heathrow was one of the best I have ever flown. This was mainly due to the cabin crew and their exceptional service. The senior purser and my assigned crew both went out of their way to make sure I was well looked after. Very polite and friendly demonstrating their high professionalism. I have flown business class so many times before but this experience was exceptional. No wonder Qatar is rated the best airline. Although the aircraft (Boeing 777-300ER) was little dated, the service provided was incomparable to the one I received on a latest B 787 I flew on with another airline. The staff I dealt with deserve an extra recognition of course.",Boeing 777-300ER,Solo Leisure,Business Class,Doha to Heathrow,July 2024,10/10,4.0,5.0,5.0,5.0,5.0,5,yes
